{"protocolVersion":"ida-rpc/1","requestId":"changeset-database-01","sessionId":"session-0001","method":"changeset.preview","params":{"operations":[{"kind":"segment.rename","address":"0x401000","value":"TEXT_RENAMED"},{"kind":"segment.permissions","address":"0x402000","value":"r-x"},{"kind":"function.flags","address":"0x403000","value":"noreturn,library"},{"kind":"xref.code.add","address":"0x404000","value":"0x405000","subject":"jump_near"},{"kind":"xref.data.delete","address":"0x406000","value":"0x407000","subject":"read"},{"kind":"function.end","address":"0x408000","value":"0x408100"},{"kind":"function.chunk.add","address":"0x409000","value":"0x40a000","subject":"0x40a100"}]},"timeoutMs":30000}
